{
  "version": 1,
  "ticksPerGameHour": 10,
  "passiveEffects": [
    { "key": "npc.n1.hunger", "amount": 1 },
    { "key": "npc.n2.hunger", "amount": 1 }
  ],
  "agents": [
    { "id": "n1", "localKeys": ["hunger", "at_forest"], "goalIds": ["stay_alive", "stock_food"] },
    { "id": "n2", "localKeys": ["hunger", "at_forest"], "goalIds": ["stay_alive", "stock_wood"] }
  ],
  "crises": [
    { "id": "famine", "conditions": [{ "key": "food", "op": "LessOrEqual", "threshold": 1 }] }
  ]
}
